line_number,section,hindi,english,roman
1.0,॥आरती॥,"आरती राधा रानी की, जय वृषभानु लली। वृंदावन की महारानी, प्रेम रस की गली॥","Aarti of Radha Rani, daughter of Vrishabhanu; queen of Vrindavan, essence of the lane of divine love","Aarti Radha Rani Ki, Jai Vrishbhanu Lali, Vrindavan Ki Maharani Prem Ras Ki Gali"
2.0,,"राधा बिना अधूरे हैं, श्री वृंदावन बिहारी। राधे बोलो, राधे बोलो, हरे भव दुख भारी॥","Without Radha, the Lord of Vrindavan is incomplete; chant Radhe Radhe, it removes the heavy sorrows of worldly existence","Radha Bina Adhoore Hain Shri Vrindavan Bihari, Radhe Bolo Radhe Bolo Hare Bhav Dukh Bhaari"
3.0,॥आरती॥,आरती राधा रानी की॥,Aarti of Radha Rani,Aarti Radha Rani Ki
4.0,,"बरसाने की लली, नंद की दुलारी। कृष्ण की प्राण प्रिया, राधा प्यारी॥","Daughter of Barsana, beloved of Nanda's son; the dearest of Krishna's life, the lovely Radha","Barsane Ki Lali Nand Ki Dulari, Krishna Ki Pran Priya Radha Pyari"
5.0,॥आरती॥,आरती राधा रानी की॥,Aarti of Radha Rani,Aarti Radha Rani Ki
6.0,,"राधा रानी की आरती जो कोई भक्त गावे। राधा कृष्ण के चरण में, स्थान निश्चित पावे॥",Whoever sings this aarti of Radha Rani; certainly attains a place at the feet of Radha-Krishna,"Radha Rani Ki Aarti Jo Koi Bhakt Gaave, Radha Krishna Ke Charan Mein Sthaan Nishchit Paave"
7.0,॥आरती॥,"आरती राधा रानी की, जय वृषभानु लली॥","Aarti of Radha Rani, daughter of Vrishabhanu","Aarti Radha Rani Ki, Jai Vrishbhanu Lali"
,|| अंत ||,,,
