line_number,section,hindi,english,roman
1.0,॥आरती॥,"जय गोरखनाथ देवा, जय जय गोरखनाथ। नाथ पंथ के स्वामी, हर लो जन के ताप॥","Victory to Lord Gorakhnath; master of the Nath tradition, remove the suffering of devotees","Jai Gorakhnath Deva, Jai Jai Gorakhnath, Nath Panth Ke Swami Har Lo Jan Ke Tap"
2.0,,"मत्स्येन्द्र शिष्य, योगी महान। हठ योग के पिता, कर दो कल्याण॥","Disciple of Matsyendranath, the great yogi; father of Hatha Yoga, grant us welfare","Matsyendra Shishya Yogi Mahaan, Hath Yog Ke Pita Kar Do Kalyan"
3.0,॥आरती॥,जय गोरखनाथ देवा॥,Victory to Lord Gorakhnath,Jai Gorakhnath Deva
4.0,,"कान में कुंडल, हाथ में चिमटा। जटाधारी, भस्म लगाए, रूप लगे अनूठा॥","Earrings in ears, tongs in hand; matted-haired, smeared with ash, his form is unique and wondrous","Kaan Mein Kundal Haath Mein Chimta, Jatadhari Bhasm Lagaye Roop Lage Anutha"
5.0,॥आरती॥,जय गोरखनाथ देवा॥,Victory to Lord Gorakhnath,Jai Gorakhnath Deva
6.0,,"गोरखनाथ की आरती, जो कोई जन गावे। शिव का रूप, नाथ का वरदान, सब सुख पावे॥",Whoever sings this aarti of Gorakhnath; receives the blessing of Shiva and the grace of the Nath tradition,"Gorakhnath Ki Aarti Jo Koi Jan Gaave, Shiv Ka Roop Nath Ka Vardan Sab Sukh Paave"
7.0,॥आरती॥,"जय गोरखनाथ देवा, जय जय गोरखनाथ॥",Victory to Lord Gorakhnath,"Jai Gorakhnath Deva, Jai Jai Gorakhnath"
,|| अंत ||,,,
