line_number,section,hindi,english,roman
1.0,॥आरती॥,"जय भैरव बाबा, जय भैरव बाबा। काल भैरव महाकाल, भव दुख हर लाबा॥","Victory to Baba Bhairav, the great Kal Bhairav; remover of the sorrows of worldly existence","Jai Bhairav Baba, Jai Bhairav Baba, Kaal Bhairav Mahakal Bhav Dukh Har Laba"
2.0,,"काशी के कोतवाल, काल भैरव भारी। भैरव कुण्ड में नहाए, संकट सब टारी॥","Guardian of Kashi, the great Kal Bhairav; those who bathe in the Bhairav Kund have all troubles removed","Kashi Ke Kotwal Kaal Bhairav Bhaari, Bhairav Kund Mein Nahaaye Sankat Sab Taari"
3.0,॥आरती॥,जय भैरव बाबा॥,Victory to Baba Bhairav,Jai Bhairav Baba
4.0,,"भस्म रमाए अंग में, रुद्राक्ष की माला। श्याम वर्ण, भयंकर रूप, पर भक्तों पर उजाला॥","Body smeared with ash, wearing a rudraksha garland; dark-complexioned and fearsome in form, yet a light for devotees","Bhasm Ramaye Ang Mein Rudraksh Ki Mala, Shyam Varn Bhayankar Roop Par Bhakton Par Ujala"
5.0,॥आरती॥,जय भैरव बाबा॥,Victory to Baba Bhairav,Jai Bhairav Baba
6.0,,"जो कोई भैरव की आरती, नित्य नेम गावे। कालभैरव की कृपा से, मनोकामना पावे॥","Whoever sings Bhairav's aarti daily with devotion; by Kaal Bhairav's grace, all wishes are fulfilled","Jo Koi Bhairav Ki Aarti Nitya Nem Gaave, Kaal Bhairav Ki Kripa Se Manokamna Paave"
7.0,॥आरती॥,"जय भैरव बाबा, जय भैरव बाबा॥",Victory to Baba Bhairav,"Jai Bhairav Baba, Jai Bhairav Baba"
,|| अंत ||,,,
