line_number,section,hindi,english,roman
1.0,॥दोहा॥,"जय चित्रगुप्त महाराज, कर्म लेखक भगवान। न्याय करते सब जीवों का, धर्म का हैं निधान॥","Victory to Chitragupta Maharaj, the divine accountant; dispenser of justice for all beings, treasure of righteousness","Jai Chitragupta Maharaj, Karm Lekhak Bhagwan, Nyay Karte Sab Jeevon Ka, Dharm Ka Hain Nidhan"
2.0,॥चौपाई॥,जय चित्रगुप्त ब्रह्मा पुत्र। कायस्थ कुल के भाग्य सूत्र॥,"Victory to Chitragupta, son of Brahma; thread of destiny for the Kayastha community","Jai Chitragupta Brahma Putra, Kayastha Kul Ke Bhagya Sutra"
3.0,,लेखनी और दवात हाथ में। कर्मों का लेखा जोखा साथ में॥,Pen and inkpot held in hand; keeping accounts of all deeds alongside,"Lekhani Aur Davat Haath Mein, Karmon Ka Lekha Jokha Saath Mein"
4.0,,यम के सहायक धर्म के रक्षक। सत्य और न्याय के भक्षक॥,"Helper of Yama, protector of dharma; upholder of truth and justice","Yam Ke Sahayak Dharm Ke Rakshak, Satya Aur Nyay Ke Bhakshak"
5.0,,दीपावली के बाद द्वितीया। चित्रगुप्त पूजन की रीया॥,The second day after Diwali; is the tradition of Chitragupta worship,"Deepawali Ke Baad Dwitiya, Chitragupta Poojan Ki Riya"
6.0,,कायस्थ समाज के आराध्य। सब कर्मों के हैं आराध्य॥,Worshipped by the Kayastha community; worshipped for all deeds,"Kayastha Samaj Ke Aradhya, Sab Karmon Ke Hain Aradhya"
7.0,,चित्रगुप्त चालीसा जो पढ़े। न्याय और धर्म का मार्ग बढ़े॥,Whoever reads the Chitragupta Chalisa; the path of justice and dharma grows,"Chitragupta Chalisa Jo Padhe, Nyay Aur Dharm Ka Marg Badhe"
8.0,॥दोहा॥,"जय चित्रगुप्त न्यायधीश, कर्म के रखवाले। भक्त जनों के पाप काटो, जीवन करो उजाले॥","Victory to Chitragupta the judge, guardian of karma; cut the sins of devotees and illuminate their lives","Jai Chitragupta Nayyadhish, Karm Ke Rakhwale, Bhakt Janon Ke Pap Kato, Jeevan Karo Ujale"
,|| अंत ||,,,
