line_number,section,hindi,english,roman
1.0,॥दोहा॥,जय कुबेर धनपति देव। यक्षराज के अधिपति सेव॥,"Victory to Kubera, lord of wealth; serving the king of Yakshas","Jai Kuber Dhanpati Dev, Yakshraj Ke Adhipati Sev"
2.0,॥चौपाई॥,उत्तर दिशा के रक्षक कुबेर। धन और निधि के पालक कुबेर॥,"Kubera, guardian of the North direction; Kubera, protector of wealth and treasures","Uttar Disha Ke Rakshak Kuber, Dhan Aur Nidhi Ke Palak Kuber"
3.0,,अलकापुरी में विराजत राजा। धन के देवता का शुभ काजा॥,The king dwelling in Alakapuri; the auspicious work of the god of wealth,"Alkapuri Mein Virajat Raja, Dhan Ke Devata Ka Shubh Kaja"
4.0,,नव निधियों के स्वामी कुबेर। लक्ष्मी के साथ पूजें कुबेर॥,"Kubera, lord of the nine treasures; worship Kubera along with Lakshmi","Nav Nidhiyon Ke Swami Kuber, Lakshmi Ke Saath Poojen Kuber"
5.0,,दिवाली पर विशेष पूजन। धन प्राप्ति का शुभ अनुष्ठान॥,Special worship is performed on Diwali; the auspicious ritual for attaining wealth,"Diwali Par Vishesh Poojan, Dhan Prapti Ka Shubh Anushthan"
6.0,,कुबेर चालीसा जो पढ़े। धन और समृद्धि नित्य बढ़े॥,Whoever reads the Kubera Chalisa; wealth and prosperity grow daily,"Kuber Chalisa Jo Padhe, Dhan Aur Samridhi Nitya Badhe"
7.0,॥दोहा॥,जय जय कुबेर धनपति राजा। धन देते भरो हमारा खाजा॥,Victory to Kubera the wealthy king; give wealth and fill our treasury,"Jai Jai Kuber Dhanpati Raja, Dhan Dete Bharo Hamara Khaja"
,|| अंत ||,,,
