line_number,section,hindi,english,roman
1.0,॥आरती॥,"यशोमति मैया से बोले नंदलाला। राधा क्यों गोरी, मैं क्यों काला॥",Baby Krishna says to Mother Yashoda: why is Radha fair and I dark?,"Yashomati Maiya Se Bole Nandlala, Radha Kyun Gori Main Kyun Kala"
2.0,,"मैया मेरी रस की गागर, माखन चोर। यशोमति मैया की गोद में बैठा, चैन की झोर॥","O Mother, I am the pot of nectar, the butter thief; resting in Yashoda's lap, full of peace","Maiya Meri Ras Ki Gagar Makhan Chor, Yashomati Maiya Ki God Mein Baitha Chain Ki Jhor"
3.0,॥आरती॥,यशोमति मैया से बोले नंदलाला॥,Baby Krishna says to Mother Yashoda,Yashomati Maiya Se Bole Nandlala
4.0,,"तुम मुझे मारो ना मैया, मैं माखन नहीं खाया। ग्वाल बाल मिलकर मुझ पर, झूठा दोष लगाया॥","Do not beat me Mother, I did not eat the butter; the cowherds together blamed me falsely","Tum Mujhe Maro Na Maiya Main Makhan Nahin Khaya, Gwal Bal Milkar Mujh Par Jhootha Dosh Lagaya"
5.0,॥आरती॥,यशोमति मैया से बोले नंदलाला॥,Baby Krishna says to Mother Yashoda,Yashomati Maiya Se Bole Nandlala
6.0,,"ऐसे नटखट कान्हा को, मैया दुलराए। कृष्ण की लीला देखकर, सारा जग हर्षाए॥","Yashoda lovingly pampers the mischievous Kanha; seeing Krishna's playful deeds, the whole world rejoices","Aise Natkhat Kanha Ko Maiya Dulraye, Krishna Ki Leela Dekhkar Sara Jag Harshaye"
7.0,॥आरती॥,"यशोमति मैया से बोले नंदलाला। राधा क्यों गोरी, मैं क्यों काला॥",Baby Krishna says to Mother Yashoda,"Yashomati Maiya Se Bole Nandlala, Radha Kyun Gori Main Kyun Kala"
,|| अंत ||,,,
